review_id,steamid,language,sentiment,voted_up,created_kst,updated_kst,created_unix,updated_unix,votes_up,votes_funny,weighted_vote_score,steam_purchase,received_for_free,review,status,gone_kst,first_seen_kst,last_seen_kst,flip_count,flip_log
228366969,76561197988873375,french,positive,TRUE,2026-06-20 08:01:05,2026-06-20 08:01:05,1781910065,1781910065,0,0,0.5,TRUE,FALSE,Très bon DLC.,active,,2026-06-20 09:05:08,2026-06-22 08:05:10,0,
228367158,76561198451906062,italian,positive,TRUE,2026-06-20 08:05:00,2026-06-20 08:05:00,1781910300,1781910300,0,0,0.5,FALSE,FALSE,PEAK,active,,2026-06-20 09:05:08,2026-06-22 08:05:10,0,
228367916,76561198033914036,english,positive,TRUE,2026-06-20 08:21:39,2026-06-20 08:21:39,1781911299,1781911299,0,0,0.4762,TRUE,FALSE,"kind of gives you exactly what you want, More Dave the Diver.

Exploring the world as Dave is pretty fun, and the passage of time never really felt like it had much of a pressure after the first couple of days. 

There's quiet a few mini games this time around, from fishing in ponds, to bird hunting. And Beetle collecting which is just rock paper scissors and is probably the least fun activity included since its just... well rock paper scissors and zero strategy. 

There's an RPG element to the game similar to the likes of paper mario and other turn based rpgs. It's simple, but pretty fun.

The ending to the DLC though, is something of a let down. No cool fight, just, a short but slow dungeon and then cutscenes of something that would be really cool to explore.",active,,2026-06-20 09:05:08,2026-06-22 08:05:10,0,
228368985,76561198096660212,schinese,negative,FALSE,2026-06-20 08:42:15,2026-06-20 08:42:15,1781912535,1781912535,1,0,0.5069,TRUE,FALSE,我要捕鱼！！dlc根本不给我下水的时间！！,active,,2026-06-20 10:05:07,2026-06-22 08:05:10,0,
228369023,76561198065330683,english,positive,TRUE,2026-06-20 08:43:00,2026-06-20 08:43:00,1781912580,1781912580,0,0,0.4762,TRUE,FALSE,"Just as good, if not better, than the base game.",active,,2026-06-20 10:05:07,2026-06-22 08:05:10,0,
228370433,76561198345897604,english,negative,FALSE,2026-06-20 09:14:18,2026-06-21 18:07:23,1781914458,1782032843,66,2,0.5941,TRUE,FALSE,"Already heavily dislike the time management per day. I literally love your game in the first place because of the chillness. But now, hell no with a fat character that can't even run properly in an already large map, who can't even shake a tree and get all items down one shot. If I wanted time management, I could have just played Stardew Valley. Bug battles are boring as well, luck-based and repititive. And I really really hate that they focus too much on the land with unnecessary pokemon battles, it doesn't feel like you dive a lot anymore. You dive only once per day so far. Previously, they had you choose diving 2 times or 3 times with the night shift (WHICH WAS FUN). WHY REMOVE IT? Why?? It's called Dave the DIVER for a reason. Why do game developers keep doing this to their games, DAMN. I'm actually absolutely disappointed for waiting this long for...this. And whatever the hell happened with achievements? Why are you guys siding with people who don't play the game?",active,,2026-06-20 10:05:07,2026-06-22 08:05:10,0,
228371117,76561197977745475,english,positive,TRUE,2026-06-20 09:28:58,2026-06-20 09:28:58,1781915338,1781915338,0,0,0.5,TRUE,FALSE,"MintRocket has done it again. 
What an incredible continuation with all the expected attention to detail I would expect.
There's easily enough content in this DLC for it to be a separate game or sequel, and for $10?
I just finished it and Steam shows about 18.5 hours of play time. I was focused on getting through the story but I didn't do everything either.
The main title deserves to have a Labor or Love award. Truly.",active,,2026-06-20 11:05:09,2026-06-22 08:05:10,0,
228371746,76561197970488116,english,positive,TRUE,2026-06-20 09:43:00,2026-06-20 09:43:00,1781916180,1781916180,5,1,0.5166,TRUE,FALSE,"Amazing DLC, essentially a whole entire new game of Dave the Diver.  Had some great pleasant surprises.  Also everyone commenting on the 'active time' has apparently never played stardew valley?  There is literally no rush to do anything. In fact the active time system lets you dive multiple times a day if you like to bring in multiple loads of goods/fish.  Lots of fun tributes to many other games if you know, you know.",active,,2026-06-20 11:05:09,2026-06-22 08:05:10,0,
228372173,76561198081781982,schinese,negative,FALSE,2026-06-20 09:52:36,2026-06-20 09:56:53,1781916756,1781917013,1,0,0.457,TRUE,FALSE,这呼吸器的设定真的恶心，跟水下的鱼打半天，结果呼吸器不够了，毒死了，身上东西全没了，在水下有时间限制有什么意思，制作组你自己玩过吗？做这个东西意义在哪，除了硬拖玩家时常凸显自己游戏内容多是吧？,active,,2026-06-20 11:05:09,2026-06-22 08:05:10,0,
228372240,76561199099015962,koreana,positive,TRUE,2026-06-20 09:54:04,2026-06-20 09:56:10,1781916844,1781916970,1,0,0.5,TRUE,FALSE,물고기 좀 잡아서 운영 좀 하고 싶은데 퀘스트 하나를 깨면 자꾸 뭘 더 구해달라는게 많음. 초반이라 주민 호감도작 하는 건 맞지만 귀찮을 정도로 해야할 게 많아서 짜증남;; 연출과 퀄리티는 기대했던 만큼 만족해서 퀘스트 귀찮아 하시는 분들은 비추합니다.,active,,2026-06-20 11:05:09,2026-06-22 08:05:10,0,
228372570,76561198970707250,english,positive,TRUE,2026-06-20 10:00:51,2026-06-20 10:00:51,1781917251,1781917251,3,2,0.5031,TRUE,FALSE,"Holy peak, I absolutely love Dave the Diver and believe its one of the best games. They cooked again with this DLC, its basically an entire new game. Definitely worth a try, it is awesome.",active,,2026-06-20 11:05:09,2026-06-22 08:05:10,0,
228372773,76561198367994551,schinese,negative,FALSE,2026-06-20 10:05:14,2026-06-20 10:05:14,1781917514,1781917514,53,9,0.6446,TRUE,FALSE,真不知道是哪个人才策划出的DLC，此dlc的主要玩法就是RPG打老鼠，打蛇，打浣熊，打猴子，在迷宫里面推箱子，在丛林里猜拳兜虫斗乐，在加上neta一些烂梗小游戏。这些内容起码占了主线流程80%游戏时长，完全在耗费你对本体的好感与耐心。,active,,2026-06-20 11:05:09,2026-06-22 08:05:10,0,
228372880,76561198053888638,english,positive,TRUE,2026-06-20 10:08:00,2026-06-20 10:08:00,1781917680,1781917680,0,0,0.5,TRUE,FALSE,"""Bumblebee tuna!""",active,,2026-06-20 11:05:09,2026-06-22 08:05:10,0,
228373483,76561198844544276,schinese,negative,FALSE,2026-06-20 10:21:01,2026-06-20 10:21:01,1781918461,1781918461,0,0,0.4762,TRUE,FALSE,第一次给游戏写评价，真的狗屎，到了晚上永远不能开店，右上指针都转到第二天了背景还是黄昏，回寿司店再去丛林还是这样,active,,2026-06-20 11:05:09,2026-06-22 08:05:10,0,
228374489,76561197971360221,portuguese,positive,TRUE,2026-06-20 10:43:27,2026-06-20 10:43:27,1781919807,1781919807,0,0,0.5,TRUE,FALSE,"Loved it, a bit short, but a great addition to the main game.",active,,2026-06-20 12:35:06,2026-06-22 08:05:10,0,
228375402,76561199218976499,schinese,negative,FALSE,2026-06-20 11:04:40,2026-06-21 19:11:25,1781921080,1782036685,1,0,0.5238,TRUE,FALSE,主线流程很短，一堆傻逼小游戏，还有能不能把那个破时间系统取消了,active,,2026-06-20 12:35:06,2026-06-22 08:05:10,0,
228376027,76561198321390157,schinese,positive,TRUE,2026-06-20 11:19:56,2026-06-20 11:19:56,1781921996,1781921996,0,0,0.5,TRUE,FALSE,内容全程至少15h+ 体验很好 本地化一开始有问题第二天就改了,active,,2026-06-20 12:35:06,2026-06-22 08:05:10,0,
228376120,76561198014103909,koreana,positive,TRUE,2026-06-20 11:22:25,2026-06-20 22:06:37,1781922145,1781960797,0,0,0.495,TRUE,FALSE,내가 운이 없었네. 죄다 비슷한 애니메이션만 나와서 대충했나 했는데 운없게도 비슷한것만 걸렸던거였음,active,,2026-06-20 12:35:06,2026-06-22 08:05:10,0,
228376407,76561199222668028,koreana,positive,TRUE,2026-06-20 11:29:33,2026-06-20 13:05:42,1781922573,1781928342,1,0,0.5,TRUE,FALSE,만원에 이정도면 아주 만족합니다,active,,2026-06-20 12:35:06,2026-06-22 08:05:10,0,
228376512,76561199553354139,schinese,negative,FALSE,2026-06-20 11:31:53,2026-06-20 11:31:53,1781922713,1781922713,0,4,0.3143,TRUE,FALSE,mc,active,,2026-06-20 12:35:06,2026-06-22 08:05:10,0,
228376628,76561198093707966,koreana,negative,FALSE,2026-06-20 11:34:11,2026-06-20 11:34:11,1781922851,1781922851,2,0,0.5044,TRUE,FALSE,"부족한 수상 육상 컨텐츠를 미니게임으로 구상만 좋아 보이게 뽑기만 하고
데이브 더 다이버 라는 기본적인 우리가 알던 그 데이브 라는 느낌이 많이 퇴색한 것 같다. 
그만큼 기대감이 컷다고 생각한다.
정글 이라는 좋은 컨텐츠 IP를 이따위로 밖에 못 써먹나? 싶은 생각이 지워지질 못한다.
또한 조금씩 나눠서 콜라보를 추가해주면 이것도? 하고 재미로 웃으며 넘기겠으나
그 데이브 초창기 콜라보 감각을 잊은건가?
그리고 인어마을 시즌2 이 느낌을 지울수가 없다.
미니게임 천국을 만들고 싶었던 건지 아니면 데이브의 또 다른 모험을 만들고 싶었던건지 분간이 안간다.",active,,2026-06-20 12:35:06,2026-06-22 08:05:10,0,
228378108,76561199638042631,brazilian,positive,TRUE,2026-06-20 12:05:54,2026-06-20 12:05:54,1781924754,1781924754,1,0,0.5259,TRUE,FALSE,melhor dlc de jogo que eu ja vi. bom demaissss,active,,2026-06-20 13:35:08,2026-06-22 08:05:10,0,
228378206,76561199348906443,schinese,negative,FALSE,2026-06-20 12:08:03,2026-06-20 12:08:03,1781924883,1781924883,1,0,0.5,TRUE,FALSE,auv这给我干哪来了这还是潜水员吗，玩这游戏就想爽快捕点鱼，晚上经营门店，像本体一样，中途稍微加一点小游戏调调味就很舒服了。结果陆地上呆的时间占了快一半，跑图跑来跑去还搞各种送礼物加好感，缝了一大堆杂七杂八的小游戏显得乱七八糟，整这出我为啥不直接去玩宝可梦，还有其他小游戏的本体呢，游戏是个好游戏，但和本体还有我想要玩到的有点“小”相径庭,active,,2026-06-20 13:35:08,2026-06-22 08:05:10,0,
228378479,76561198103427859,schinese,positive,TRUE,2026-06-20 12:14:10,2026-06-20 12:14:10,1781925250,1781925250,0,0,0.5,TRUE,FALSE,音游玩法的手感很差，经常漏判定，虽然不是主要玩法，但是确实玩的血压很高，希望优化,active,,2026-06-20 13:35:08,2026-06-22 08:05:10,0,
228378963,76561198987605298,schinese,negative,FALSE,2026-06-20 12:24:42,2026-06-20 12:24:42,1781925882,1781925882,0,0,0.5,FALSE,FALSE,这主线强制过RPG是认真的吗，玩的红温了,active,,2026-06-20 13:35:08,2026-06-22 08:05:10,0,
228379663,76561199443178375,schinese,negative,FALSE,2026-06-20 12:40:10,2026-06-20 12:40:10,1781926810,1781926810,0,0,0.5,TRUE,FALSE,潜水员啊，DLC重点全在村子里，潜水内容淡化太多了,active,,2026-06-20 13:35:08,2026-06-22 08:05:10,0,
228379746,76561198412857912,schinese,positive,TRUE,2026-06-20 12:42:02,2026-06-20 12:42:02,1781926922,1781926922,0,0,0.5,TRUE,FALSE,大概12小时左右的流程 依旧缝合 依旧好玩 直接给到夯,active,,2026-06-20 13:35:08,2026-06-22 08:05:10,0,
228380467,76561198082855314,koreana,positive,TRUE,2026-06-20 12:58:01,2026-06-20 12:58:01,1781927881,1781927881,12,0,0.6306,FALSE,FALSE,"처음나왔을 땐 너무 육지에서 할일이 많고, 본편처럼 수중에서 놀고싶었던 저는 조금 지루한것같은 게임진행에 실망할뻔 하다가, 점점해보니까 정글의 매력에 빠져버렸어요. 리얼타임제가 아쉽다고 생각했지만 그만큼 정신없이 오전오후가 빨리 지나가서 좋았고, 물질말고도, 재밌는 미니게임, 턴제게임요소를 볼 수 있어서 좋았습니당
호감도 시스템이 1편보다 안귀찮아서 좋았어요. 그리고 데더다를 보면 .. 참 자잘한 모션들도 애니메이션처럼 넣어놔서 이번 정글편을 얼마나 사랑을담아 만들었는지를 알 수 있더라고요 ㅋㅋ
그래서 처음엔 그냥 엔딩만보고 끝내야지 했다가,  다 보니까 도감 다 채우고 싶어서 한번 더 했어요. 뭔가 DLC지만 본편이라고해도 무방할 정도입니다. 저한텐 딱 이정도 볼륨이 진짜 맞는거같아요. 

엔딩 다보고나서야 킥보드를 개선시키는 방법을 알아서 ㅠㅠ 킥보드가 많이 느리다고 생각하시는분들 필독 
[spoiler]  림보의 호감도를 빨리 꽉꽉채우시길바랍니다.  [/spoiler]",active,,2026-06-20 14:35:06,2026-06-22 08:05:10,0,
228380617,76561198961307677,schinese,positive,TRUE,2026-06-20 13:01:23,2026-06-20 13:01:23,1781928083,1781928083,0,0,0.5,TRUE,FALSE,还是喜欢的，这游戏的画风我很喜欢，DLC玩法也OK吧，融入了很多小游戏，里面有个小狗进草丛有鸟出来用枪打鸟的游戏，太有回忆感了，是我很小时候玩的插卡带的那种游戏，有玩具手枪可以对着屏幕打的那个。潜水经营占比变小了，可能也是因为在丛林，偏陆地吧，其他玩法多了，就是很多经典游戏融合的，不过捉树上的昆虫太麻烦了，每次都得打一局，新作料理人班桥不出意外我也会支持的。,active,,2026-06-20 14:35:06,2026-06-22 08:05:10,0,
228380802,76561199531124852,schinese,positive,TRUE,2026-06-20 13:06:26,2026-06-21 22:37:05,1781928386,1782049025,0,0,0.5,TRUE,FALSE,"一般吧，不知道为什么有一个材料一直卡我，而且明明图鉴上说了可以买，却买不到，搞得我很多顶级料理做不了，又不知道去哪里拿。
游戏整体宽度更广了，不过我越来越不喜欢玩深度不够的游戏了

后续：其实还是些本体就存在的问题，引导可以再详细一点的。时隔快两年花三十块钱再体验一下还是不错的，这次甚至还有点意犹未尽，水下内容还是太少了",active,,2026-06-20 14:35:06,2026-06-22 08:05:10,1,2026-06-21 23:35:12 negative->positive
228380896,76561198351153706,schinese,positive,TRUE,2026-06-20 13:08:25,2026-06-20 13:08:25,1781928505,1781928505,0,0,0.5,TRUE,FALSE,好玩还是好玩的，可以直接问喜欢什么就很舒服了，但是猜拳甲虫我真的红温，数值谁填的，普通甲虫和更厉害的甲虫数值差距太大了吧，都没有容错。,active,,2026-06-20 14:35:06,2026-06-22 08:05:10,0,
228381078,76561198180958406,schinese,positive,TRUE,2026-06-20 13:12:09,2026-06-20 13:12:09,1781928729,1781928729,0,0,0.5,TRUE,FALSE,"内容少要喷，内容多也要喷，评测区众口难调这一块
陆地内容我还觉得少呢，收集游戏不多搞点收集内容那还玩啥",active,,2026-06-20 14:35:06,2026-06-22 08:05:10,0,
228381460,76561198211207685,thai,positive,TRUE,2026-06-20 13:21:11,2026-06-20 13:21:11,1781929271,1781929271,0,0,0.5,TRUE,FALSE,Dave the jungler.,active,,2026-06-20 14:35:06,2026-06-22 08:05:10,0,
228381497,76561198301376295,thai,positive,TRUE,2026-06-20 13:22:17,2026-06-20 13:22:17,1781929337,1781929337,0,0,0.5,TRUE,FALSE,เป็นdlcที่ดีที่สุดละตอนนี้,active,,2026-06-20 14:35:06,2026-06-22 08:05:10,0,
228381912,76561198079241389,tchinese,negative,FALSE,2026-06-20 13:31:10,2026-06-20 13:31:10,1781929870,1781929870,8,1,0.5135,TRUE,FALSE,實在玩不下去，這製作組簡直走火入魔了，這DLC簡單講就是拿各種沒完沒了的小遊戲糊你滿臉，同時塞一堆垃圾支線逼你抓緊白天時間做這做那的，遊戲體驗被搞得一蹋糊塗。,active,,2026-06-20 14:35:06,2026-06-22 08:05:10,0,
228382288,76561198269240881,schinese,negative,FALSE,2026-06-20 13:39:55,2026-06-20 16:11:49,1781930395,1781939509,4,2,0.5092,TRUE,FALSE,"虚假的核心玩法：下水摸鱼开餐厅；
真正的核心玩法：跑图猜拳通马桶。

刚刚发现滑板车太超模了，建议改成租，每次使用消耗7个币，跟租车村民熟络后消耗4个币。",active,,2026-06-20 14:35:06,2026-06-22 08:05:10,0,
228382918,76561197976337585,english,positive,TRUE,2026-06-20 13:53:54,2026-06-20 13:53:54,1781931234,1781931234,0,0,0.5,TRUE,FALSE,"What a great DLC so far, fun jungle theme with so much to do. They really increased the amount of time and different missions on land from the base game as well as having the diving aspect there. Very impressed with the variety of different things you can do. Keep up the great work",active,,2026-06-20 14:35:06,2026-06-22 08:05:10,0,
228383155,76561199249775885,schinese,positive,TRUE,2026-06-20 13:59:33,2026-06-20 13:59:33,1781931573,1781931573,0,0,0.5,FALSE,FALSE,好玩,active,,2026-06-20 15:35:06,2026-06-22 08:05:10,0,
228383790,76561198004796496,koreana,positive,TRUE,2026-06-20 14:14:28,2026-06-20 14:15:51,1781932468,1781932551,0,0,0.5,FALSE,FALSE,"본편에서 벗어나서 따로 시작하지만 컨텐츠가 상당히 많고
옵스퀴르33이라든가 라이언킹 오마쥬같은 것들도 많아서 보는 재미도 있었음
가격값 함",active,,2026-06-20 15:35:06,2026-06-22 08:05:10,0,
228384405,76561198835946058,schinese,negative,FALSE,2026-06-20 14:28:35,2026-06-20 14:28:35,1781933315,1781933315,0,0,0.4868,FALSE,FALSE,别买！这DLC纯纯骗钱！鱼的种类少，还加入了大量恶心人的小游戏。尤其是猴子那里，限时不说，设计极其不合理。也无法主动放弃，只能反反复复的失败，被迫回档。还有睡眠枪，新代设计简直反人类。花大价钱升级完，这睡眠效果居然连小鱼都晕不住。玩到后面才品到这坨大份，忍不住第一次给游戏打差评，你厉害了设计师！,active,,2026-06-20 15:35:06,2026-06-22 08:05:10,0,
228384426,76561198066198934,japanese,positive,TRUE,2026-06-20 14:29:05,2026-06-20 14:29:05,1781933345,1781933345,0,0,0.5,TRUE,FALSE,"ターン制RPGを持ち合わせていなかった！（DLCにて追加

ひょっとしたらこれが本当のHD-2Dなのかもしれない。まさかこういう形でデイヴ・ザ・ダイバーのプレイフィールが変わるとは。

いや、やっていることは本編と概ね同じ何ですけどね。

DLCを余すことなくプレイした結果、本作の追加要素は、

牧〇物語　であり
ぼく〇つ　であり
マリ〇RPG　であり
ピク〇ンブルーム

でした。

あと、もう数え上げたらキリがないくらいのパロディ、コラボ。
とつぜんMiSideはじまったり、鳴潮コラボはじまったり、シャンクスだったり、遠征隊33だったり。

DLCではなく欲張りパックですよ、これ。",active,,2026-06-20 15:35:06,2026-06-22 08:05:10,0,
228384657,76561198108092873,schinese,positive,TRUE,2026-06-20 14:34:31,2026-06-20 14:34:31,1781933671,1781933671,0,0,0.5,TRUE,FALSE,综合素质比本体要高，节奏把握和各种游戏元素之间的衔接更加自然流畅，能看出来明显的用心和改进。感觉制作组和bancho一样经过历练，找到了老派经典RPG的那种醍醐味。和单纯的模拟经营类游戏不同，绝对不应该把一种核心玩法堆料到让玩家玩到吐，即便这个过程中玩家产生类似戒断反应的不适，也必须插入足够的配菜玩法作为调剂。丛林DLC对乌塔拉这个湖畔村庄的塑造，能让玩家切实感觉到，这个活跃的丛林聚落生态，俨然自成一体，却并不遗世独立。鲛人村真正被诟病其实还是塑造不够，互动性有限，维持遗世独立状态的同时，失去了只有戴夫/玩家才可以深度互动探索的可玩性和神秘感/特殊感。成了一个收菜都嫌麻烦的地方。如果主线世界能专门出一个物流系统（有相应的人物/剧情），让戴夫用手机就可以呼叫无人机/潜艇/船只运送各类食材，这样就能把玩家解放出来，专注于潜水探索和餐厅经营。甚至可以依靠这个系统连接不同DLC和主世界，让这个游戏框架能支撑更多特殊地理/生态dlc。,active,,2026-06-20 15:35:06,2026-06-22 08:05:10,0,
228384807,76561198931810132,koreana,negative,FALSE,2026-06-20 14:38:12,2026-06-20 14:38:12,1781933892,1781933892,15,1,0.5867,TRUE,FALSE,"본편 엔딩까지 싹밀면서 가장 짜증났던게 달리기 키 토글 없는거인데

이 DLC는 그 짜증을 불쾌함으로 극대화 시켜줌

모든 행동에 쉬프트키를 누르고 움직여야 하는데 손가락 뒤지게 아픔

왜 토글 키 쳐 안만드는거임? 그게 그렇게 어려움?",active,,2026-06-20 15:35:06,2026-06-22 08:05:10,0,
228385442,76561198107804910,tchinese,positive,TRUE,2026-06-20 14:53:26,2026-06-21 12:17:56,1781934806,1782011876,0,0,0.5,TRUE,FALSE,"DLC必買，內容差不多等於半個本體，裡面還塞了一大堆彩蛋，即便新手直接完DLC也沒甚麼問題
這個價格跟內容就值得給好評了

但問題也明顯，因為塞了一大堆彩蛋跟系統，導致整個DLC後面就像只做一半而已

最明顯的問題就是END GAME的部分，還沒到後期很多功能都用不到了，比如餐廳系統，撐死最多就只有18個客人，你想要升級料理就需要派遣，但是很多店員都是後期才拿到，等於是拿到之後餐廳也滿星了，不知道要幹嘛了

比如路上採集變成回合對戰遊戲，但角色生到10級之後，不用靠武器也隨便打，所以商店賣的武器基本沒用，然後打了很多鳥肉跟蛇肉跟一堆素材，基本都用不到

釣魚系統也是，感覺為了加而加，其他類似的多於系統有
1.打鳥遊戲 > 鳥肉只能考串，不能做料理，打心酸的
2.種植系統 > 種完缺材料做料理，種心酸的
3.抓蟲系統 > 抓完解鎖 員工，但不能派遣，能力值也沒多好，而且已經接近結束了
4.抓蜥蜴系統 > 不懂意義
5.滑板車 > 遊戲最後才給電動滑板車，但已經用不到了
6. 村民好感度系統> 解鎖到進店用餐，就沒了",active,,2026-06-20 15:35:06,2026-06-22 08:05:10,0,
