review_id,steamid,language,sentiment,voted_up,created_kst,updated_kst,created_unix,updated_unix,votes_up,votes_funny,weighted_vote_score,steam_purchase,received_for_free,review,status,gone_kst,first_seen_kst,last_seen_kst,flip_count,flip_log
228421061,76561198022760686,english,positive,TRUE,2026-06-21 01:06:45,2026-06-21 01:06:45,1781971605,1781971605,0,0,0.5,TRUE,FALSE,"so I just finished the dlc and I got to say. this could have been it's own game, the quality of this dlc is immaculate and the amount of new mechanics makes it seem like it could be a new game. the story is great, the new fish are great in design, the bosses are fun with new mechanics, and the new weapon is a definite upgrade to the base games weaponry. I recommend this games dlc, 10/10",active,,2026-06-21 02:05:08,2026-06-22 08:05:10,0,
228422005,76561198297226930,koreana,positive,TRUE,2026-06-21 01:19:49,2026-06-21 01:19:49,1781972389,1781972389,0,0,0.5,TRUE,FALSE,"기다린 보람이 있습니다. 퀘스트 좋아하시면 강력추천합니다.
자잘한 미니게임들도 많이 추가 되었고, 정글 호수 다이빙도 가게운영도 역시 재밌습니다!!",active,,2026-06-21 02:05:08,2026-06-22 08:05:10,0,
228422721,76561198405740628,schinese,negative,FALSE,2026-06-21 01:29:20,2026-06-21 01:29:20,1781972960,1781972960,3,0,0.5436,TRUE,FALSE,读指令的剪刀石头布小游戏我真是开眼了,active,,2026-06-21 03:05:08,2026-06-22 08:05:10,0,
228423376,76561199732943770,schinese,positive,TRUE,2026-06-21 01:38:23,2026-06-21 01:38:23,1781973503,1781973503,0,0,0.5,TRUE,FALSE,还可以，但是抓甲虫的小游戏就是屎,active,,2026-06-21 03:05:08,2026-06-22 08:05:10,0,
228423634,76561198401364339,schinese,negative,FALSE,2026-06-21 01:42:00,2026-06-21 01:45:26,1781973720,1781973926,18,1,0.6567,TRUE,FALSE,把石头剪刀布设计进来的就tm的没脑子，这种随机游戏还加血量和攻击进来不是二逼是什么,active,,2026-06-21 03:05:08,2026-06-22 08:05:10,0,
228424435,76561198164758551,english,negative,FALSE,2026-06-21 01:53:28,2026-06-21 01:54:08,1781974408,1781974448,15,0,0.5964,TRUE,FALSE,"I like the DLC cause it adds a buttload of content, but this new time mechanic is terrible. 

In the base game I could explore at my own pace, but here I'm constantly rushing. 
All these great new collectibles and areas are wasted because I'm too busy rushing to do as much as possible before the time runs out and the game forces you to stop,

just ended up paying more attention to the clock instead of admiring the game. If they remove that mechanic or have an option to disable it, it would be great.",active,,2026-06-21 03:05:08,2026-06-22 08:05:10,0,
228424483,76561199385339222,english,negative,FALSE,2026-06-21 01:54:07,2026-06-21 14:33:35,1781974447,1782020015,10,0,0.5102,TRUE,FALSE,"As a devoted Dave the Diver player, don't waste your money on this dlc. They tried to add too many new mechanics to the game with no actual time to play them. The beetle mini game is based off of chance so you won't be able to win based off of your skills. There are also way too many cut scenes that are way too long. It is very annoying and gets in the way of gameplay. And worst of all, the game is extremely buggy. This is no longer a chill and fun game. Too much grinding that doesn't amount to much. Please save your money. They also use AI which is not disclosed anywhere so these aren't the type of people you want to support anyways.",active,,2026-06-21 03:05:08,2026-06-22 08:05:10,0,
228424805,76561198068837153,english,negative,FALSE,2026-06-21 01:58:34,2026-06-21 01:58:34,1781974714,1781974714,17,0,0.604,TRUE,FALSE,Why would they ruin the flow of the base game with real time limits on exploration?,active,,2026-06-21 03:05:08,2026-06-22 08:05:10,0,
228424940,76561198425815616,thai,positive,TRUE,2026-06-21 02:00:29,2026-06-21 02:00:29,1781974829,1781974829,0,0,0.5,TRUE,FALSE,วันหนึ่งฉันเดินเข้าป่า...,active,,2026-06-21 03:05:08,2026-06-22 08:05:10,0,
228425259,76561198045393079,japanese,positive,TRUE,2026-06-21 02:05:04,2026-06-21 18:30:59,1781975104,1782034259,1,0,0.5276,TRUE,FALSE,"クリアしたけれどもうちょっと遊びたくなるくらいの丁度いいボリューム
本編の面白さをそのままに他にも出来る事をいろいろ詰め込みまくったようなDLC
本編が楽しめたなら買って損はないと思う（虫取りのムシ対決要素だけは苦手だが
本編と違い水中銃が可変式になって実質4丁持っているのと同等のシステムになっているので戦闘・捕獲に関してストレスが激減しているのが◎",active,,2026-06-21 03:05:08,2026-06-22 08:05:10,0,
228425664,76561199285183907,schinese,negative,FALSE,2026-06-21 02:11:01,2026-06-21 02:12:27,1781975461,1781975547,0,0,0.5,TRUE,FALSE,变成了一个大型缝合怪！一会动森，一会星露谷的。当然，叉鱼这一块还是很不错的，老味道很好玩。但是在岸上，要问候、要送礼，一会要采集、一会要斗虫（这里不会是搬了原神吧），居然还要种树！东西也太多了，都没时间下水叉鱼了！什么钓鱼、摇树（而且还得摇三下捡三下！！！）完全没必要！还有去森林，搞一堆篝火也不能传送，每次想要什么资源还要从头开始嘛？？！而且打怪，越往后越难，怎么到了神庙里又变简单了？！好不容易走到神庙里，给点结晶算怎么回事，这玩意不是到处都有么，需要去了那么远的地方捡这个嘛？？！相比本体的纯粹，DLC真的就是杂乱、冗余！,active,,2026-06-21 03:05:08,2026-06-22 08:05:10,0,
228425702,76561198833555971,german,positive,TRUE,2026-06-21 02:11:31,2026-06-21 02:11:31,1781975491,1781975491,0,0,0.5,TRUE,FALSE,"PEAK DLC, Wann machen Entwickler mal wieder so n DLC was vollgepackt ist mit Content?!",active,,2026-06-21 03:05:08,2026-06-22 08:05:10,0,
228425804,76561198213742416,koreana,negative,FALSE,2026-06-21 02:12:45,2026-06-21 02:14:42,1781975565,1781975682,1,0,0.5,TRUE,FALSE,"본편에 비해 물질 비중은 팍 줄이고 마을, 정글 육지 컨텐츠는 속도 개느리고 답답한 미니게임천국임

정글파트 거의 만렙 찍어서 몹이랑 전투 안 들어가고
필드에서 한방에 다 청소하기 시작하면 진짜 컨텐츠의 존재 의의가 없어짐
왜냐고? 정글에서 얻는 건 오로지 꼬치재료밖에 없거든...
요리 핵심 재료는 어차피 물질이여...

사슴벌레 싸움은 아무리 용같 그대로 베꼈다고 해도 참아주기 힘든 가위바위보 운빨+스펙빨 ㅈ망겜임 대체 왜 넣은 거냐",active,,2026-06-21 03:05:08,2026-06-22 08:05:10,0,
228425927,76561198329062137,schinese,negative,FALSE,2026-06-21 02:14:23,2026-06-21 02:14:23,1781975663,1781975663,0,0,0.5,TRUE,FALSE,水里的内容还是不错的，非常好玩，新丛林也很好玩，但是这游戏不是叫潜水员戴夫吗，你搞这么多路上内容是干嘛？？？？最tm讨厌回合制宝可梦，甲虫我忍了，那个回合制的路上任务纯恶心人，现在不建议入手，建议等一下等修改器更新了再入手，有体验会好很多,active,,2026-06-21 03:05:08,2026-06-22 08:05:10,0,
228427858,76561198091013362,japanese,negative,FALSE,2026-06-21 02:42:37,2026-06-21 02:42:37,1781977357,1781977357,7,1,0.5797,TRUE,FALSE,"チャーハン食いたくて注文したら
ラーメンとギョーザと半チャーハンのセットが出てきた感じ",active,,2026-06-21 04:05:08,2026-06-22 08:05:10,0,
228427950,76561198232021988,tchinese,positive,TRUE,2026-06-21 02:43:58,2026-06-21 02:43:58,1781977438,1781977438,0,0,0.5,TRUE,FALSE,玩這個DLC，我只能說，謝謝MINTROCKET，重新讓我體驗我最愛的童年，甲蟲王者，單是這個小遊戲，對我來說，已經值了。,active,,2026-06-21 04:05:08,2026-06-22 08:05:10,0,
228427986,76561198276904644,schinese,negative,FALSE,2026-06-21 02:44:34,2026-06-21 02:44:34,1781977474,1781977474,0,0,0.5,TRUE,FALSE,冲你主线强制玩音游就活该吃个差评,active,,2026-06-21 04:05:08,2026-06-22 08:05:10,0,
228429584,76561198114466392,schinese,positive,TRUE,2026-06-21 03:08:19,2026-06-21 03:08:19,1781978899,1781978899,0,0,0.4762,TRUE,FALSE,DLC质量还是很高的，恶搞成分挺多的，缝的基本都能接受，众口难调，我个人还是很满意的，期待下一部DLC！！！,active,,2026-06-21 04:05:08,2026-06-22 08:05:10,0,
228429782,76561198041357352,english,positive,TRUE,2026-06-21 03:11:29,2026-06-21 03:11:29,1781979089,1781979089,1,0,0.4818,TRUE,FALSE,"If you enjoyed the base game, you will enjoy the DLC. Plenty of new content for the price.",active,,2026-06-21 04:05:08,2026-06-22 08:05:10,0,
228430454,76561198044060697,english,positive,TRUE,2026-06-21 03:21:28,2026-06-21 03:21:28,1781979688,1781979688,0,0,0.4693,TRUE,FALSE,fun,active,,2026-06-21 04:05:08,2026-06-22 08:05:10,0,
228430503,76561198142806604,schinese,positive,TRUE,2026-06-21 03:22:04,2026-06-21 03:22:04,1781979724,1781979724,1,0,0.5217,TRUE,FALSE,这破甲虫猜拳小游戏我就没赢过，生气了,active,,2026-06-21 04:05:08,2026-06-22 08:05:10,0,
228430774,76561199554178377,schinese,positive,TRUE,2026-06-21 03:26:10,2026-06-21 03:26:10,1781979970,1781979970,0,0,0.4324,TRUE,FALSE,玩到现在一半了吧，满分10分的话，本体9分dlc8分，硬塞二游再扣一分，勉强算个中上。捕鱼部分经典好玩，丛林打猎挺无聊的，玩法一般正反馈一般玩得很累人，玩本体的时候通宵通得酣畅淋漓，现在一看见要进林子打回合制小游戏就厌烦地退出了。东西塞太多了，可能是想丰富玩法吧，但是捕鱼以外的玩法比重太大了，没有本体那种两眼一睁就是叉鱼的愉悦感，与其加一些不好玩的新东西还不如扩展湖里的地图。然后莫名其妙塞些二游内容进来恶心人不知道啥意思，联动内容麻烦标出来让玩家避雷行吗，你以为谁都爱看你那二游吗。好评是给鱼的。,active,,2026-06-21 04:05:08,2026-06-22 08:05:10,0,
228431407,76561198009012761,koreana,positive,TRUE,2026-06-21 03:35:49,2026-06-21 03:35:49,1781980549,1781980549,0,0,0.5,TRUE,FALSE,"나름 재미있게 했음. 가격대비 분량 혜자. 하지만 본편 출시후 첫 DLC 기다린 기간 치고는... 사실 2가 나왔어야 했는데.
대형 어종 숫자 아쉽고, 작살 업그레이드가 안되서 총만 쏨.
분량대비 총기 업그레이드에 필요한 특수재료가 뒤지게 안나와서 스토리 다 밀때까지 최종 업글은 커녕 그 전 업글도 못함..
본편을 이제 접해서 연속해서 플레이 하는 유저들에게는 가볍게 즐길만한 혜자 DLC.
2가 나온다면 레스토랑 경영 분량좀 늘려주길..",active,,2026-06-21 05:05:10,2026-06-22 08:05:10,0,
228431966,76561198136500571,schinese,positive,TRUE,2026-06-21 03:44:36,2026-06-21 03:44:36,1781981076,1781981076,0,0,0.5,TRUE,FALSE,我喜欢,active,,2026-06-21 05:05:10,2026-06-22 08:05:10,0,
228433083,76561198970158989,schinese,negative,FALSE,2026-06-21 04:00:50,2026-06-21 04:00:50,1781982050,1781982050,7,0,0.6001,TRUE,FALSE,"《这是一段很好的经历》

穆娜：“戴夫，对不起，因为我错算了炸弹的威力，差点害死了你。”

戴夫：“没事，虽然我的朋友为了救我被鳄鱼撕了一条胳膊，我也因此在恐龙的大肠里当了一回粪海狂蛆，差不点和肠道内的答辩永远烂在一起。但是多亏了你，我认识了一群村民，我狠开心。“

不敢想象如果我是戴夫，出来之后能不能忍住把博士和助手当场毙了。在柯布拉残疾之后，片尾曲居然还是如此活泼而欢快，这表达的是什么精神内核？

一切的利用，都是如此的心安理得。本来没有义务去做的事，大包大揽不计代价，根本就不把自己的命当命。

这是个在海里捕鱼的游戏，不是音乐游戏。强制你去成人礼打鼓，还有又臭又长的电吉他，我就问一下有谁是能一遍过的？过不了还不行，就必须得过这个剧情。那只能说玩一遍制作组的亲妈就起飞一遍。估计再有dlc就是以那个重力颠倒的古代世界为背景了，下次直接穿越到侏罗纪去海里打恐龙

真是后悔买了这个dlc

",active,,2026-06-21 05:05:10,2026-06-22 08:05:10,0,
228433561,76561198363188068,schinese,positive,TRUE,2026-06-21 04:07:48,2026-06-21 04:07:48,1781982468,1781982468,1,0,0.4985,TRUE,FALSE,"夸张哦 鸣潮牛逼
",active,,2026-06-21 05:05:10,2026-06-22 08:05:10,0,
228433854,76561198098312666,english,positive,TRUE,2026-06-21 04:11:50,2026-06-21 04:11:50,1781982710,1781982710,1,0,0.4925,TRUE,FALSE,"It's not just DAVE THE DIVER dlc, it's more like Dave the diver 2 ( or 1.5 I don' know)
everything they offer is entirely new contents, and can even be new separate small game entirely, not gonna lie",active,,2026-06-21 05:05:10,2026-06-22 08:05:10,0,
228433920,76561198868696289,latam,positive,TRUE,2026-06-21 04:12:58,2026-06-21 04:12:58,1781982778,1781982778,0,0,0.5,TRUE,FALSE,"Increible Content Pack, nuevas funciones, animaciones, detalles, gran historia... me esta dejando sin palabras.",active,,2026-06-21 05:05:10,2026-06-22 08:05:10,0,
228435394,76561198097591088,brazilian,positive,TRUE,2026-06-21 04:34:47,2026-06-21 04:34:47,1781984087,1781984087,0,0,0.5,TRUE,FALSE,"Essa DLC ta supimpa, não terminei todo o conteúdo ainda mas já to muito feliz com a compra",active,,2026-06-21 06:05:09,2026-06-22 08:05:10,0,
228436130,76561198022034346,italian,positive,TRUE,2026-06-21 04:46:12,2026-06-21 04:46:12,1781984772,1781984772,0,0,0.5,TRUE,FALSE,Bello come il primo :),active,,2026-06-21 06:05:09,2026-06-22 08:05:10,0,
228436537,76561198244746792,english,negative,FALSE,2026-06-21 04:52:16,2026-06-21 04:52:16,1781985136,1781985136,7,1,0.5488,TRUE,FALSE,"So im left wondering who paid the developers to undercut there own content so badly. Apparently putting a hard timer on days passing by so you felt like you dont have time to fish and a toxicity build up in the water so you dont have time to fish was something the creators wanted as end game content.

so make a hardcore mode toggle?

just give me a button to stop both of those hard caps

this would be great otherwise

but you removed one of the best parts of the chill vibe with that.",active,,2026-06-21 06:05:09,2026-06-22 08:05:10,0,
228436609,76561198217327028,tchinese,positive,TRUE,2026-06-21 04:53:11,2026-06-21 04:53:11,1781985191,1781985191,0,0,0.5,TRUE,FALSE,還沒開始遊玩這個DLC的內容，看到官方在這麼快的速度內就對玩家意見進行反饋並修正，先給一個好評,active,,2026-06-21 06:05:09,2026-06-22 08:05:10,0,
228436859,76561199258088647,schinese,positive,TRUE,2026-06-21 04:56:44,2026-06-21 05:02:04,1781985404,1781985724,1,0,0.5198,TRUE,FALSE,"屎？！
我只是来下海捞鱼的，给我干哪来了

整体还是个中上评价吧，缝的有点多了，但本质上个店员不怎么影响
本体成长曲线的问题完全没解决，该卡脖子的菜照样卡脖子，甚至也不会像之前一样给每道菜配个推文，感觉没有肝长线的动力
还搞了一套完整的陆上战斗系统也是有点绷不住了，不过深度也不深，敌我战斗力差距有点大，基本靠输出可以纯碾过去，后期把大aoe点出来基本一件扫荡了
通马桶比本体设计的好不少，至少能让人有通的意愿，不是纯搞人的，斗虫我没玩明白，纯剪刀石头布吗，没怎么深入玩
最让我出戏的大概是失心刘辉洲打过来了吧，哪来的古风小生",active,,2026-06-21 06:05:09,2026-06-22 08:05:10,0,
228437475,76561198194043389,english,positive,TRUE,2026-06-21 05:06:18,2026-06-21 05:06:18,1781985978,1781985978,0,0,0.5,TRUE,FALSE,"Dave the Diver excelled at introducing you to new mechanics, new encounters, and new characters. In the base game, there is much to do! Diving for unique fish that further the quality of your favorite dishes, be it the ones that bring you personal happiness, the ones that make you the most money, or the dishes that just sound the most tasty to you. In this DLC, the game goes above and beyond to bring you more of the delightful fantasy that is being Dave, everyone's favorite professional diver. 

In the Jungle provides you with more of that fantasy, introducing more mechanics, more dishes, more fish, items, the list goes on and on. In my opinion, this felt like a sequel in its own special way, save for the length. The vast amount of species allows for a more challenging and thought-provoking experience, in that you are left thinking about freshwater fish and saltwater fish in their own respects. Time passes much faster, rather than in segments. Though this is an understandable point of contention for many players, I found it endearing and not unlike the timescale presented by games like Stardew Valley, which I assume is the vibe that Mint Rocket was going for. Familiar mechanics like farming make a return, and exciting new ones such as the turn-based RPG battles that happen in the forest shine brilliantly in tandem with the systems you already understand. 

This DLC is worth your time if you are a casual player looking for more interesting things to do within the world of Dave the Diver, though it lacks additional achievements for those who want to feel a sense of fulfillment chasing that 100% completion. From gaining the trust of the villagers, to unexpected crossovers and minigames, In the Jungle is a superb addition to our journey into the blue hole and beyond! I truly hope that more content is planned for this game, it would be a shame to see Dave the Diver end on such an alluring note [spoiler] (That being the new area we see at the end of the DLC). [/spoiler]",active,,2026-06-21 06:05:09,2026-06-22 08:05:10,0,
228437949,76561197998804838,english,positive,TRUE,2026-06-21 05:13:51,2026-06-21 05:13:51,1781986431,1781986431,0,1,0.5,TRUE,FALSE,"I was ready for this to be a lazy dlc and it absolutely refused to be. it does not play like the base game. you think you know the loop and then you don't, it keeps yanking the rug, and i mean that as the highest compliment. the quests actually respect you too, none of that fetch-me-X filler, you're building real trust with the villagers and it pays off. i can't say more without ruining it. you've read enough, the fact you're still here is honestly your problem now :D just get it.",active,,2026-06-21 06:05:09,2026-06-22 08:05:10,0,
228438188,76561198000689633,english,positive,TRUE,2026-06-21 05:17:17,2026-06-21 05:17:17,1781986637,1781986637,0,0,0.5,TRUE,FALSE,"Excellent DLC. If you loved the main game, this is a perfect expansion that captures all the fun and wild antics of the main questline. I feel like I got more than my money's worth on this purchase.",active,,2026-06-21 06:05:09,2026-06-22 08:05:10,0,
228438472,76561198976057488,schinese,negative,FALSE,2026-06-21 05:22:09,2026-06-21 05:22:09,1781986929,1781986929,7,1,0.4489,TRUE,FALSE,"本体+DLC 220小时，这个DLC很失望：
1.请把钱花在刀刃上，别搞这些乱七八糟的俊福联动，把钱花在提升游戏实质内容上。
2.本体的体验到了鲛人村直线下降，DLC又来一次，听不进玩家的反馈，不知道玩家到底玩什么。
3.名字叫潜水员戴夫，大家想要的是更多的料理，更多的鱼种，更多潜水，更多的种田，而不是一堆小游戏和繁杂的支线。
4.整个游戏就像个半成品，很难想象一个DLC的内容就15-20小时，而且大多数的内容完全都是过任务，养成和经营可以说少之又少，全收集+剧情之后料理没一个满的。
5.一棵树的东西居然要摇三下，徒增玩家的操作和浪费时间。果园还不能一键收集，种子还不齐全，想要黄桃把把都要去海滩去摇。
6.正常的游戏来说，一部分DLC的内容都可以带到本体。然而这个DLC和本体毫无联动，员工，料理，素材，全都带不到本体，农场难道就不能拓展联动DLC吗？你养殖场最后两个格子不能养DLC的鱼吗？

这个DLC可以说是反转口碑的一个失败品。希望后期可以优化内容，不然差评不改了。
",active,,2026-06-21 06:05:09,2026-06-22 08:05:10,0,
228438743,76561199028531833,english,positive,TRUE,2026-06-21 05:26:32,2026-06-21 05:26:32,1781987192,1781987192,0,0,0.5,TRUE,FALSE,"I really enjoy this DLC! I think it is one of the best dlcs i have got to play, reminds me a little of stardew valley at times which is a game i do really love and it is fun to talk with all the new villagers and interact with them, great dlc.",active,,2026-06-21 07:05:08,2026-06-22 08:05:10,0,
228438963,76561198401111930,koreana,positive,TRUE,2026-06-21 05:30:11,2026-06-21 05:30:11,1781987411,1781987411,0,0,0.5,TRUE,FALSE,볼륨이 제법 크다.. 어디서 많이 본 것 같은 미니게임 요소까지ㅋㅋ 뭔가 다이빙 게임에서 잡다한 요소들이 추가되어 귀찮긴 함. 게임상 시간이 너무 빨리 흘러서 너무 바쁨. 육지 파밍도 해야하고. 물질도 해야하고 너무 바쁨 ..  그리고 데이브 이 놈 발걸음이 너무 느림. 제발 이속 신발 좀 주셈 ㅜㅜ ㅋ 답답해 죽어요 .. 이 단점을 커버할 수 있는 점? 바로 가격. 2만원 넘어갔으면 환불 때렸을 듯,active,,2026-06-21 07:05:08,2026-06-22 08:05:10,0,
228438977,76561198077723254,italian,positive,TRUE,2026-06-21 05:30:29,2026-06-21 05:30:29,1781987429,1781987429,0,0,0.5,TRUE,FALSE,"Meravigliosa espansione che ci regala un'altra volta una lunga avventura con Dave e i suoi amici. Nuove meccaniche e nuovi posti da esplorare. Ancora più coinvolgente e vi regalerà altre ore di questo fantastico gioco.
Da comprare ad occhi chiusi!",active,,2026-06-21 07:05:08,2026-06-22 08:05:10,0,
228442387,76561198321782894,english,negative,FALSE,2026-06-21 06:23:12,2026-06-21 06:23:12,1781990592,1781990592,17,2,0.6615,TRUE,FALSE,"Everything people wanted from this DLC was more of the same - a new area in which to dive, and some more mechanics in the restaurant to give a bit of a change of pace. Easy, right?

WRONG.

The devs, being Korean, have obviously looked at the success of Crimson Desert and abandoned their own path, instead opting for the ""more is more"" philosophy of throwing every possible genre at the player. Instead of just catching fish and cooking it, you now also have to dungeoncrawl in a very unbalanced JRPG, do Pokemon-styled battles with beetles with literal RPS mechanics, and participate in many, many other very, very poorly thought-out side activities.

Outside of the new diving area and the new restaurant, every single addition is a downgrade. To quote the Angry Video Game Nerd, WHAT WERE THEY THINKING? All you had to do was make more of the same game, and you couldn't even do that. If you wanted make a JRPG, you could've taken the capital you got from Dave the Diver (you know, the diving game) and develop a new game with new IP - you don't have to ram every single bullet point you generated in a brainstorming session into your existing product. 

I was really looking forward for a reason to return to Dave the Diver, but this POS is pretty much the opposite. I'm going to try and get a refund now, and will give this a [b]1/10[/b],",active,,2026-06-21 07:05:08,2026-06-22 08:05:10,0,
228442737,76561198107087032,english,positive,TRUE,2026-06-21 06:28:39,2026-06-21 06:28:39,1781990919,1781990919,5,1,0.5417,TRUE,FALSE,"I loved the base game and all the DLCs before IN THE JUNGLE.
I'm very glad to say that my opinion of this one is no different. 
New mechanics, new areas to explore, more unique and easily lovable characters, more creature's to catch and collect, and don't even get me started on the very addictive new JRPG mode. 

It's nice to play a game that feels like it was made by people who really enjoyed making it. Every part of this game and ALL the DLCs ooze with creative joy!

Looking for to whatever the Devs do next XD",active,,2026-06-21 08:05:10,2026-06-22 08:05:10,0,
228443233,76561199351092875,brazilian,positive,TRUE,2026-06-21 06:36:01,2026-06-21 06:36:01,1781991361,1781991361,0,0,0.5,TRUE,FALSE,"Um dos melhores jogos Indie que eu já joguei em toda a minha vida, e junto com está DLC, na qual eu já zerei as ultimas lançadas, está se supera mais ainda. Valeu cada centavo gasto. Que jogo maravilhoso, cada momento do jogo é extremante satisfatório de jogar, e digo que pela historia desta DLC, há uma cara de parte 2, uma possível continuação desta DLC na qual eu espero que ocorra!!!!",active,,2026-06-21 08:05:10,2026-06-22 08:05:10,0,
228444866,76561198380031580,french,positive,TRUE,2026-06-21 07:04:28,2026-06-21 07:04:28,1781993068,1781993068,0,0,0.5,TRUE,FALSE,"Le DLC est dingue . Franchement , achetez le , Drole , avec de très bonne idée , et vachement long en vrai , j'ai pas encore finie et je pense etre loin de la fin .",active,,2026-06-21 08:05:10,2026-06-22 08:05:10,0,
228446071,76561198396146078,koreana,positive,TRUE,2026-06-21 07:25:50,2026-06-21 07:25:50,1781994350,1781994350,0,0,0.5,TRUE,FALSE,"힐링 갓겜
민트로켓 후속작은 다 결제하겠음",active,,2026-06-21 08:05:10,2026-06-22 08:05:10,0,
228446076,76561198097688993,english,positive,TRUE,2026-06-21 07:25:58,2026-06-21 07:25:58,1781994358,1781994358,3,2,0.5283,TRUE,FALSE,One of the best DLC's for a good price! Adds a lot of new features while staying true to the original game.,active,,2026-06-21 08:05:10,2026-06-22 08:05:10,0,
